<!ELEMENT konyvek (konyv+)>
<!ELEMENT konyv (cim,ev,kiado,szerzo,absztrakt)>
<!ATTLIST konyv id NMTOKEN #REQUIRED>
<!ELEMENT cim (#PCDATA)>
<!ELEMENT ev (#PCDATA)>
<!ELEMENT kiado (#PCDATA)>
<!ELEMENT szerzo (#PCDATA)>
<!ELEMENT absztrakt (#PCDATA|absztrakt)*>